{
  "proposal_id": "APRP_01J2K9QX4R8S6B7C5D3E1F0GJ6",
  "agent_name": "conversation_agent",
  "agent_model": "local-model",
  "proposal_type": "TASK_ASSIGNMENT",
  "subject_type": "TASK",
  "subject_id": "TASK_01J2K9QX4R8S6B7C5D3E1F0GHW",
  "input_snapshot_hash": "sha256:aaaaaaaaaaaaaaaaaaaaaaaaaaaaaaaaaaaaaaaaaaaaaaaaaaaaaaaaaaaaaaaa",
  "recommendation": {
    "employee_ids": [
      "EMP_01J2K9QX4R8S6B7C5D3E1F0GHV"
    ]
  },
  "rationale_summary": "当前负荷较低",
  "confidence": 0.83,
  "risk_level": "LOW",
  "requires_human_review": true,
  "rules_triggered": [
    "MVP_MANUAL_FINAL_ASSIGNMENT"
  ],
  "created_at": "2026-07-12T08:10:00Z"
}
